<xs:element name="catalog" type="cd">
  <xs:complexType name="cd">
    <xs:sequence>
      <xs:element name="title" type="xs:string"/>
      <xs:element name="artist" type="xs:string"/>
      <xs:element name="country" type="xs:string"/>
      <xs:element name="company" type="xs:string"/>
      <xs:element name="price" type="xs:decimal"/>
      <xs:element name="year" type="xs:string"/>
    </xs:sequence>
  </xs:complexType:
	
